exampl supertag citat also aim meaning syntact pre-process,,
al. lfg citat,,
control np-trace npnp follow standard techniqu mark node domin empti element includ parent anteced defect miss argument gap featur citat citat furthermor make anteced co-index possibl mani type gener collin approach enrich annot non-termin type question,,
idea thread anteced stochast parser propos citat follow gpsg tradit citat,,
citat propos algorithm abl find long-dist depend postprocess step pars,,
howev construct prove difficult stochast parser citat either avoid tackl problem citat citat deal subset problemat case citat,,
