common approach util name entiti recognit ner system like stanford ner citat recogn name thing e.g. person product name text,,
short-text ner citat propos graphic model,,
cross-domain ner citat employ search engin,,
addit compar approach stanford ner citat fine-grain entiti recognit figer citat,,
address problem citat defin fine-grain set tag base freebas entiti extract,,
metro map propos citat also relat work,,
differ citat employ large-scal entiti repositori extract meaning interpret key term entiti make subtop much easier understand,,
