citat recogn paraphras use tree vector phrase structur tree constitu associ,,
task recogn textual entail dataset order compar directli logic-bas system citat focu dataset citat includ text-hypothesi t-h pair develop set pair test set,,
particular perform wors strict acc chanc markert strict best system challeng citat vs-add vs-mul vs-pairwis avgcomb w/o varbind phrase dir determinist phrase dir tabl result test set,,
best perform competit citat ensembl system integr mani techniqu includ string similar,,
third scale pairwis word similar sentenc level use weight averag weight invers document frequenc idf suggest citat vspairwis,,
citat use framework rte deriv infer cost wordnet similar properti syntact pars,,
approach view bridg citat pure logic approach reli pure hard logic rule theorem prove distribut approach support grade similar concept notion logic oper entail,,
entail citat system use logic,,
citat propos approach rte use mln combin tradit logic represent distribut inform order support probabilist textual infer,,
citat conceptu textual entail tree rewrit syntact graph rewrit rule distribut infer rule,,
rte task system evalu use accuraci confidence-weight score use citat challeng citat,,
semant textual similar task judg similar two sentenc scale citat,,
exist rte approach closest citat employ pure logic approach use boxer convert premis hypothesi first-ord logic check entail use theorem prover,,
