previou work sentenc order mainli focu task citat citat citat citat madnani al. citat citat citat citat,,
citat employ featur base discours entiti shallow,,
overal order determin citat prove find permut maxim agre pref npcomplet,,
relat work work take use sourc document citat propos probabilist model learn constraint sentenc order corpu text,,
probabl model origin citat implement model four featur lemmat noun verb adject adverb verb noun relat depend,,
citat investig util domain-specif content model repres topic topic shift model perform well five select domain,,
typic applic text gener field concept-to-text gener text-totext gener citat multipl document summar question answer,,
two featur noun probabl depend probabl play import role demonstr citat,,
