2 Related Work Sentiment classification has become a hot topic since the publication work that discusses classification of movie reviews by CITATION,,
It is worth noting that CITATION deal with the domain adaptation problem for sentiment classification where labeled data from one domain is used to train a classifier for classifying data from a different domain,,
As the training data from DVDs is much more similar to books than that from kitchen CITATION, we should give the data from DVDs a higher weight,,
1 This data set is collected by CITATION: http://www.seas.upenn.edu/~mdredze/datasets/sentiment/ 2 LIBSVM is an integrated software for SVM: http://www.csie.ntu.edu.tw/~cjlin/libsvm/ Training Data from Domain 1 Training Data from Domain 2 Training Data from Domain m Multiple Classifier System 1 Testing Data from Domain 1 Testing Data from Domain 2 Testing Data from Domain m ,,
The selection method is Bi-Normal Separation (BNS) that is reported to be excellent in many text categorization tasks CITATION,,
1 Introduction Sentiment classification is a special task of text categorization that aims to classify documents according to their opinion of, or sentiment toward a given subject (e.g., if an opinion is supported or not) CITATION,,
2 Related Work Sentiment classification has become a hot topic since the publication work that discusses classification of movie reviews by CITATION,,
It is worth noting that CITATION deal with the domain adaptation problem for sentiment classification where labeled data from one domain is used to train a classifier for classifying data from a different domain,,
Experiment Implementation: We apply SVM algorithm to construct our classifiers which has been shown to perform better than many other classification algorithms CITATION,,
A well-known method called meta-learning (ML) has been shown to be very effective CITATION,,
