depend relationship offer condens represent inform need assess relationship form depend tree citat shortest depend path citat includ entiti,,
prior work zelenko al. citat citat current research citat citat kernel method show potenti relat extract,,
citat propos slightli gener version kernel depend tree success match two relat instanc requir node layer ident path start root current node,,
interest feature-bas method pleas refer citat detail,,
howev detail research citat show difficult extract new effect featur improv extract accuraci,,
kernel method use depend tree citat shortest depend path citat suffer low recal perform convolut tree kernel citat citat syntact pars tree achiev,,
citat develop shortest path depend tree kernel simpli count number common word class node shortest path two entiti depend tree,,
